{
  "id": "learn",
  "group": "agent-system",
  "origin": "original",
  "invocation": [
    "explicit"
  ],
  "sources": [
    {
      "repository": "https://www.youtube.com/watch?v=5Bmp9cz1JN8",
      "ref": "video:5Bmp9cz1JN8;published:2026-10-26",
      "path": "transcript#t=1527-1613,1681-1697",
      "digest": "sha256:3e073bc9fa97ba8b33f1b700cd2bb450bfe843ed279f347dbb15924f888e0ffa",
      "license": "reference-only-no-copied-text",
      "use": "informed-by",
      "changes": "Theo, These 3 skills changed my life (2026-10-26), YouTube 5Bmp9cz1JN8. Transcript inspected 25:27–26:53 and 28:01–28:17. Trigger descriptions and model-loadable workflows; optional command syntax. Independently written adaptation; no transcript text copied. Digest identifies this bounded evidence note, not video bytes or a full transcript."
    }
  ],
  "dependencies": {
    "skills": [
      "grilling",
      "research",
      "teach",
      "verify"
    ],
    "tools": []
  },
  "reviewed": "2026-10-26"
}
