{
  "id": "writing-for-agents",
  "group": "writing-and-artifacts",
  "origin": "synthesized",
  "invocation": [
    "supporting"
  ],
  "sources": [
    {
      "repository": "https://github.com/mattpocock/skills",
      "ref": "3cca18b368ae95cdbdebbff572ccafa662551015",
      "path": "skills/productivity/writing-for-agents",
      "digest": "git-tree:ad2925850efb8973a72d2e666f7a975f9a2d4a9b",
      "license": "mit-mattpocock",
      "use": "adapted",
      "changes": "Methods selectively consolidated into Elias's owned writing-for-agents capability; vendor routing and unrelated framework assumptions removed."
    },
    {
      "repository": "https://github.com/cursor/plugins",
      "ref": "5bf2b1544db739998121a306340631963c2ff3de",
      "path": "pstack/skills/technical-writing",
      "digest": "git-tree:e91d48c91a740d16d25ea5f2fbbad14bcf5d5332",
      "license": "mit-pstack",
      "use": "adapted",
      "changes": "Retained local derivative compared against the pinned source, not claimed as an exact upstream version. Source paths, blob identities, complete local comparison diffs and file hashes are in docs/provenance/retained-sources.json; historical authorship of each delta is not asserted. MIT notice retained."
    }
  ],
  "dependencies": {
    "skills": [],
    "tools": []
  },
  "reviewed": "2026-10-26"
}
