{
  "id": "nextjs",
  "group": "engineering-specialists",
  "origin": "adapted",
  "invocation": [
    "supporting"
  ],
  "sources": [
    {
      "repository": "openai://curated-skills",
      "ref": "reviewed-2026-09-14",
      "path": "vercel/nextjs",
      "digest": "version:reviewed-2026-09-14",
      "license": "proprietary-reference",
      "use": "informed-by",
      "changes": "Methods selectively consolidated into Elias's owned nextjs capability; vendor routing and unrelated framework assumptions removed."
    }
  ],
  "dependencies": {
    "skills": [
      "react"
    ],
    "tools": [
      "official-docs"
    ]
  },
  "reviewed": "2026-10-26"
}
