{
  "id": "python",
  "group": "engineering-specialists",
  "origin": "synthesized",
  "invocation": [
    "supporting"
  ],
  "sources": [
    {
      "repository": "https://github.com/trailofbits/skills",
      "ref": "321ccfe628eca0d314b0ee4eaffcdd8a05639aaf",
      "path": "plugins/modern-python/skills/modern-python/SKILL.md",
      "digest": "git-blob:cf5e416095b166547d383e96515377695827defd",
      "license": "cc-by-sa-4.0-trailofbits",
      "use": "copied",
      "changes": "Pinned source body retained verbatim in references/source-methods/trailofbits-modern-python.md under CC BY-SA 4.0; local changes are the attribution header, Markdown fence and relocation. Owned operational guidance is separate. Corrected the earlier informed-by classification during the 2026-10-26 publication review."
    },
    {
      "repository": "https://github.com/wdm0006/python-skills",
      "ref": "954796b7fc28e342cf08f80b9a4a39414a419c7a",
      "path": "skills/python",
      "digest": "git-tree:96d5b46125521598f50c1946e068f6224005d41a",
      "license": "mit-wdm0006",
      "use": "adapted",
      "changes": "Methods selectively consolidated into Elias's owned python capability; vendor routing and unrelated framework assumptions removed."
    }
  ],
  "dependencies": {
    "skills": [],
    "tools": [
      "python"
    ]
  },
  "reviewed": "2026-10-26"
}
