{
  "id": "accessibility",
  "group": "frontend-and-design",
  "origin": "synthesized",
  "invocation": [
    "automatic",
    "supporting"
  ],
  "sources": [
    {
      "repository": "https://github.com/hueyexe/frontend-agent-skills",
      "ref": "2841c079dd8a9c634882227194dc42e25227710d",
      "path": "accessibility-inclusive-design/SKILL.md",
      "digest": "git-blob:469fef262c4141b6ea62a0735ff25b661758a9e6",
      "license": "mit-huey",
      "use": "adapted",
      "changes": "Methods selectively consolidated into Elias's owned accessibility capability; vendor routing and unrelated framework assumptions removed."
    },
    {
      "repository": "https://github.com/addyosmani/agent-skills",
      "ref": "be4e44a9fbc5e8df0beaefadbb28bd22ee61cc39",
      "path": "skills/security-and-hardening/SKILL.md",
      "digest": "git-blob:c168e65e0d8e2ce1ec48bdaf0c1a76c0a4aa9d30",
      "license": "mit-addyosmani",
      "use": "adapted",
      "changes": "Methods selectively consolidated into Elias's owned accessibility capability; vendor routing and unrelated framework assumptions removed."
    },
    {
      "repository": "https://github.com/vercel-labs/agent-skills",
      "ref": "063bee94c3f4df8453406c830b0a7df0f2860278",
      "path": "skills/web-design-guidelines",
      "digest": "git-tree:3116f3e62dbd02b44a598b1aa690d2a8938e8f89",
      "license": "declared-mit-vercel-labs",
      "use": "copied",
      "changes": "Pinned source bodies retained in source-method snapshots with an owned heading/fence and boundary-newline normalization only: vercel-design-guidelines.md. Exact paths, upstream blob IDs, byte hashes and declaration/notice blockers are recorded in docs/provenance/retained-sources.json. The pinned README declares MIT; no upstream copyright notice is invented."
    }
  ],
  "dependencies": {
    "skills": [],
    "tools": [
      "browser",
      "official-docs"
    ]
  },
  "reviewed": "2026-10-26"
}
