{
  "id": "performance",
  "group": "engineering-specialists",
  "origin": "synthesized",
  "invocation": [
    "automatic",
    "supporting"
  ],
  "sources": [
    {
      "repository": "https://github.com/cursor/plugins",
      "ref": "5bf2b1544db739998121a306340631963c2ff3de",
      "path": "pstack/skills/poteto-mode/playbooks/perf-issue.md",
      "digest": "git-blob:e153c343190c97b2a34e50c7dd7a8063b9d2cb08",
      "license": "mit-pstack",
      "use": "adapted",
      "changes": "Retained local derivative compared against the pinned source, not claimed as an exact upstream version. Source paths, blob identities, complete local comparison diffs and file hashes are in docs/provenance/retained-sources.json; historical authorship of each delta is not asserted. MIT notice retained."
    },
    {
      "repository": "https://github.com/EveryInc/compound-engineering-plugin",
      "ref": "fd8abda7f64ead2f410da2cfd86c0c8e7cbf8187",
      "path": "skills/ce-optimize/SKILL.md",
      "digest": "git-blob:3e106f3baf196d3a355f817577f890619c84de33",
      "license": "mit-compound-engineering",
      "use": "adapted",
      "changes": "Methods selectively consolidated into Elias's owned performance capability; vendor routing and unrelated framework assumptions removed."
    },
    {
      "repository": "https://github.com/addyosmani/agent-skills",
      "ref": "be4e44a9fbc5e8df0beaefadbb28bd22ee61cc39",
      "path": "skills/observability-and-instrumentation/SKILL.md",
      "digest": "git-blob:84d9cb373467fe0e15236e190833ecc90f840c38",
      "license": "mit-addyosmani",
      "use": "adapted",
      "changes": "Methods selectively consolidated into Elias's owned performance capability; vendor routing and unrelated framework assumptions removed."
    },
    {
      "repository": "https://github.com/wdm0006/python-skills",
      "ref": "954796b7fc28e342cf08f80b9a4a39414a419c7a",
      "path": "skills/python/performance/SKILL.md",
      "digest": "git-blob:3f5a14f2ccd22ac6392a7e8af57d380bf42e4f13",
      "license": "mit-wdm0006",
      "use": "adapted",
      "changes": "Methods selectively consolidated into Elias's owned performance capability; vendor routing and unrelated framework assumptions removed."
    },
    {
      "repository": "https://felixrieseberg.com",
      "ref": "published-2026-10-13",
      "path": "how-to-be-more-ambitious-a-tutorial-for-humans-with-models/",
      "digest": "version:published-2026-10-13",
      "license": "published-works-reference",
      "use": "informed-by",
      "changes": "Propose an expert-level stretch target alongside the stated floor; independently written, no text copied."
    }
  ],
  "dependencies": {
    "skills": [
      "verify"
    ],
    "tools": []
  },
  "reviewed": "2026-10-26"
}
