{
  "id": "libraries-dev",
  "group": "frontend-and-design",
  "origin": "adapted",
  "invocation": [
    "supporting"
  ],
  "sources": [
    {
      "repository": "https://github.com/Jakubantalik/Libraries.dev",
      "ref": "f20116327f4e3b28d0fb70b04437dfd092bf88fe",
      "path": "skills/libraries-dev",
      "digest": "git-tree:1816d238fa1b97850789eba7db58d5fd4875ade6",
      "license": "mit-libraries-dev",
      "use": "adapted",
      "changes": "Owned copy of the public free skill and seven references. Preserves the reveal, read-only review, and apply workflows; removes Pro-only guidance and installer instructions, adds the reference-led design boundary, and keeps future skill updates in the canonical repository."
    }
  ],
  "dependencies": {
    "skills": [],
    "tools": []
  },
  "reviewed": "2026-10-26"
}
