{
  "id": "writing",
  "group": "writing-and-artifacts",
  "origin": "synthesized",
  "invocation": [
    "automatic"
  ],
  "sources": [
    {
      "repository": "https://github.com/EveryInc/compound-writing",
      "ref": "18702f0ece9f2b852e305807e0271b2d550d9b4b",
      "path": "skills",
      "digest": "git-tree:f775070ed8caab7cdf55ee1f525e0aa5a5b26a2d",
      "license": "declared-mit-compound-writing",
      "use": "copied",
      "changes": "Pinned source bodies retained in source-method snapshots with an owned heading/fence and boundary-newline normalization only: compound-writing-index.md, compound-writing-simplify.md. Exact paths, upstream blob IDs, byte hashes and declaration/notice blockers are recorded in docs/provenance/retained-sources.json. The pinned README declares MIT; no upstream copyright notice is invented."
    },
    {
      "repository": "https://github.com/cursor/plugins",
      "ref": "5bf2b1544db739998121a306340631963c2ff3de",
      "path": ".",
      "digest": "git-tree:331716e6a03a58540d1d2c204dc282adf7374039",
      "license": "mit-pstack",
      "use": "adapted",
      "changes": "Retained local derivative compared against the pinned source, not claimed as an exact upstream version. Source paths, blob identities, complete local comparison diffs and file hashes are in docs/provenance/retained-sources.json; historical authorship of each delta is not asserted. MIT notice retained."
    },
    {
      "repository": "https://github.com/EveryInc/compound-engineering-plugin",
      "ref": "fd8abda7f64ead2f410da2cfd86c0c8e7cbf8187",
      "path": "skills",
      "digest": "git-tree:386d76ffd0491ae2fba6d8281496f147856eb38d",
      "license": "mit-compound-engineering",
      "use": "adapted",
      "changes": "Methods selectively consolidated into Elias's owned writing capability; vendor routing and unrelated framework assumptions removed."
    },
    {
      "repository": "https://github.com/vercel-labs/agent-skills",
      "ref": "063bee94c3f4df8453406c830b0a7df0f2860278",
      "path": "skills",
      "digest": "git-tree:a2cfd42210862c1d5670669aed2f5ccd6e24ce40",
      "license": "declared-mit-vercel-labs",
      "use": "informed-by",
      "changes": "Methods selectively consolidated into Elias's owned writing capability; vendor routing and unrelated framework assumptions removed."
    },
    {
      "repository": "https://felixrieseberg.com",
      "ref": "published-2026-10-13",
      "path": "how-to-be-more-ambitious-a-tutorial-for-humans-with-models/",
      "digest": "version:published-2026-10-13",
      "license": "published-works-reference",
      "use": "informed-by",
      "changes": "Name the piece's job as an activity the reader is moved through; independently written, no text copied."
    }
  ],
  "dependencies": {
    "skills": [],
    "tools": []
  },
  "reviewed": "2026-10-26"
}
