{
  "id": "payments",
  "group": "engineering-specialists",
  "origin": "adapted",
  "invocation": [
    "supporting"
  ],
  "sources": [
    {
      "repository": "openai://curated-skills",
      "ref": "reviewed-2026-09-14",
      "path": "build-web-apps/stripe-best-practices",
      "digest": "version:reviewed-2026-09-14",
      "license": "proprietary-reference",
      "use": "informed-by",
      "changes": "Methods selectively consolidated into Elias's owned payments capability; vendor routing and unrelated framework assumptions removed."
    },
    {
      "repository": "https://github.com/humanlayer/humanlayer",
      "ref": "2f66a45b186d88488fa356862be0117db1ccae9f",
      "path": ".claude/skills/stripe-billing-verification/SKILL.md",
      "digest": "sha256:f1a5f1832bdd6946c225397a40bb79d416a3346d409224fc4d2f511571863044",
      "license": "apache-2.0-humanlayer-2026",
      "use": "adapted",
      "changes": "Independently written conditional Stripe testing reference covering delivery-specific secrets, signature rejection, signed intake, application state and fresh Test Clock fixtures. Removed fixed routes/log paths and blanket action authority; checked official Stripe docs on 2026-10-24, corrected secret-restart wording and added bounded readiness, cleanup and evidence safeguards. No provider calls or resources created. Full Apache-2.0 and current upstream NOTICE retained in licenses/."
    },
    {
      "repository": "https://docs.stripe.com",
      "ref": "reviewed-2026-10-24",
      "path": "cli/listen",
      "digest": "version:reviewed-2026-10-24",
      "license": "published-works-reference",
      "use": "informed-by",
      "changes": "Live official documentation checked on the review date to correct listener-secret restart assumptions and bound sandbox, signature and Test Clock guidance. Reference links only; no provider prose or SDK code copied. Pages are mutable and must be rechecked at execution."
    },
    {
      "repository": "https://docs.stripe.com",
      "ref": "reviewed-2026-10-24",
      "path": "webhooks",
      "digest": "version:reviewed-2026-10-24",
      "license": "published-works-reference",
      "use": "informed-by",
      "changes": "Live official documentation checked on the review date to correct listener-secret restart assumptions and bound sandbox, signature and Test Clock guidance. Reference links only; no provider prose or SDK code copied. Pages are mutable and must be rechecked at execution."
    },
    {
      "repository": "https://docs.stripe.com",
      "ref": "reviewed-2026-10-24",
      "path": "events/manage-webhook-endpoints#signature-errors",
      "digest": "version:reviewed-2026-10-24",
      "license": "published-works-reference",
      "use": "informed-by",
      "changes": "Live official documentation checked on the review date to correct listener-secret restart assumptions and bound sandbox, signature and Test Clock guidance. Reference links only; no provider prose or SDK code copied. Pages are mutable and must be rechecked at execution."
    },
    {
      "repository": "https://docs.stripe.com",
      "ref": "reviewed-2026-10-24",
      "path": "billing/testing",
      "digest": "version:reviewed-2026-10-24",
      "license": "published-works-reference",
      "use": "informed-by",
      "changes": "Live official documentation checked on the review date to correct listener-secret restart assumptions and bound sandbox, signature and Test Clock guidance. Reference links only; no provider prose or SDK code copied. Pages are mutable and must be rechecked at execution."
    },
    {
      "repository": "https://docs.stripe.com",
      "ref": "reviewed-2026-10-24",
      "path": "billing/testing/test-clocks/api-advanced-usage",
      "digest": "version:reviewed-2026-10-24",
      "license": "published-works-reference",
      "use": "informed-by",
      "changes": "Live official documentation checked on the review date to correct listener-secret restart assumptions and bound sandbox, signature and Test Clock guidance. Reference links only; no provider prose or SDK code copied. Pages are mutable and must be rechecked at execution."
    }
  ],
  "dependencies": {
    "skills": [
      "security",
      "api-design"
    ],
    "tools": [
      "official-docs"
    ]
  },
  "reviewed": "2026-10-26"
}
